{
  "schema_version": 1,
  "result_id": "result-0123456789ab",
  "task_id": "task-0123456789ab",
  "created_at": "2026-09-16T08:12:00Z",
  "task_type": "change",
  "lifecycle": {"status": "delivery-ready", "condition": null},
  "outcome": "handoff-ready",
  "summary": "The bounded change is ready for manual local landing.",
  "git": {
    "base_commit": "0123456789abcdef0123456789abcdef01234567",
    "head_commit": "89abcdef0123456789abcdef0123456789abcdef",
    "branch": "feat/task-0123456789ab"
  },
  "validation_records": ["/state/tasks/task-0123456789ab/validation/validation-0123456789ab.json"],
  "artifacts": {"handoff": "/state/tasks/task-0123456789ab/delivery/handoff.json", "report": null, "findings": null}
}
